{
  "collected_at": "2026-08-14",
  "domains": [
    "amara.am",
    "arimobile.am",
    "armbusinessbank.am",
    "armradio.am",
    "armsoft.am",
    "autojan.am",
    "byblosbankarmenia.am",
    "datatables.net",
    "e-request.am",
    "github.com",
    "gnome.org",
    "google.am",
    "googlesource.com",
    "mozilla.org",
    "tatever.am",
    "telegram.org",
    "trading.am",
    "translatewiki.net",
    "wikipedia.org",
    "yelaket.am"
  ],
  "examples": [
    "Manifest-ի բեռնում․․․",
    "{ $addonCount } հավելումների ներբեռնում և ստուգում…",
    "Ամփոփագրի բեռնում",
    "Արտիստները բեռնվում են...",
    "Բեռնում",
    "Բեռնում",
    "Բեռնում",
    "Բեռնում $1",
    "Բեռնում %s",
    "Բեռնում ...",
    "Բեռնում ...",
    "Բեռնում ...",
    "Բեռնում է",
    "Բեռնում է Facebook SDK-ն...",
    "Բեռնում...",
    "Բեռնում...",
    "Բեռնում...",
    "Բեռնում...",
    "Բեռնում...",
    "Բեռնում...",
    "Բեռնում...",
    "Բեռնում...",
    "Բեռնում...",
    "Բեռնում...",
    "Բեռնում...",
    "Բեռնում...",
    "Բեռնում...",
    "Բեռնում...",
    "Բեռնում...",
    "Բեռնում...",
    "Բեռնում...",
    "Բեռնում...",
    "Բեռնում...",
    "Բեռնում...",
    "Բեռնում․․․",
    "Բեռնում…",
    "Բեռնում…",
    "Բեռնում…",
    "Բեռնում…",
    "Բեռնում…",
    "Բեռնում…",
    "Բեռնվում է",
    "Բեռնվում է",
    "Բեռնվում է",
    "Բեռնվում է",
    "Բեռնվում է",
    "Բեռնվում է",
    "Բեռնվում է",
    "Բեռնվում է",
    "Բեռնվում է",
    "Բեռնվում է",
    "Բեռնվում է ...",
    "Բեռնվում է ․․․ 0",
    "Բեռնվում է. խնդրում ենք սպասել",
    "Բեռնվում է...",
    "Բեռնվում է․․․",
    "Բեռնվում է․․․",
    "Բեռնվում է․․․",
    "Բեռնվում է…",
    "Բովանդակության բեռնում…",
    "Եվս { $count } ֆայլերի ներբեռնում",
    "Ընդլայնման ներբեռնում և ստուգում…",
    "Թարգմանությունը բեռնվում է...",
    "Թարմացման ներբեռնում. { $transfer }",
    "Թարմացման ներբեռնում. { $transfer }",
    "Թարմացման ներբեռնում. { $transfer }",
    "Լեզվի փաթեթի ներբեռնում { $negotiatedLanguage }-ի համար…",
    "Խնդրում ենք սպասել, մինչև տեսանյութն ամբողջությամբ ներբեռնվի։",
    "Խնդրում ենք սպասել, տվյալները բեռնվում են",
    "Հաղորդագրության բեռնում...",
    "Հավաքածուի տվյալների բեռնում...",
    "Ձեր դրամապանակը բեռնվում է",
    "Ձեր հարցումն ընթացքի մեջ է, խնդրում ենք սպասել",
    "Մարդկային տեսանյութի մոդելի բեռնում",
    "Մեկնաբանությունների բեռնում…",
    "Մշակվում է",
    "Մշակվում է",
    "Մշակվում է...",
    "Մշակվում է...",
    "Ներբեռնում է...",
    "Ներբեռնում...",
    "Ներբեռնվում է { -brand-shorter-name }-ի թարմացումը",
    "Ներբեռնվում է «%@»-ը",
    "Ներբեռնվում է այլընտրանքային գրվածքի մոդելը ({ $downloadedSize }՝ { $totalSize } ՄԲ-ից)",
    "Ներբեռնվում է՝ %@ ֆայլ",
    "Ներբեռնվում է…",
    "Նիշքերի մշակում։ Խնդրում ենք սպասել…",
    "Ոճի բեռնում․․․",
    "Պահպանված որոնումները բեռնվում են",
    "Սերվերի տեղակայման վայրերի բեռնում...",
    "Սուբյեկտների բեռնում",
    "Վերջին պահումները բեռնվում են…",
    "Տվյալների բեռնում...",
    "Փաստաթղթի բեռնում...",
    "Փոխարժեքները բեռնվում են...",
    "Օգտատիրոջ հավելվածների բեռնում…",
    "Ֆայլերի վերբեռնում... (:current/:total)",
    "Ֆայլը ներբեռնվում է…",
    "բեռնում...",
    "բեռնվում է"
  ],
  "exclusions": [],
  "id": "USAGE-UX-004",
  "layers": {
    "commercial": 9,
    "community": 85,
    "government": 1,
    "media": 2,
    "professional": 3
  },
  "query": "Armenian active loading and progress messages, segmented by grammatical form and progress state",
  "total": 100,
  "variants": {
    "ellipsis-label/indeterminate": 15,
    "finite/determinate": 3,
    "finite/indeterminate": 38,
    "verbal-noun/determinate": 6,
    "verbal-noun/indeterminate": 38
  }
}
