{
  "collected_at": "2026-08-14",
  "domains": [
    "100bytelcell.am",
    "5tv.am",
    "abapharm.am",
    "acba.am",
    "agatagir.am",
    "agrocredit.am",
    "aipo.am",
    "anitour.am",
    "aop.am",
    "ar-go.am",
    "araratbank.am",
    "arb.am",
    "armaa.am",
    "armfc.com",
    "armleasing.am",
    "armswissbank.am",
    "artarmshin.am",
    "babayan.am",
    "balance.am",
    "boxter.am",
    "bshin.am",
    "cba.am",
    "cda.am",
    "celsius.am",
    "cert.gov.am",
    "cleanhouse.am",
    "danz.am",
    "das.am",
    "doghotel.am",
    "donos-arm.com",
    "dshh.am",
    "e-auctions.am",
    "e-gov.am",
    "ecofoodarmenia.am",
    "edupolice.am",
    "emall.am",
    "engineeringhub.am",
    "enricomatte.com",
    "escs.am",
    "evl.am",
    "fanbase.am",
    "fip.am",
    "furnitura.am",
    "gethbus.am",
    "granat.am",
    "guyn.am",
    "hightech.gov.am",
    "huj.am",
    "husher.am",
    "hyeka.ngo",
    "idealtruck.am",
    "ipos.am",
    "ircenter.am",
    "itarm.am",
    "jobfinder.am",
    "joffrey.am",
    "kanal.am",
    "khostum.am",
    "markacourse.com",
    "media.am",
    "mediamonitoring.am",
    "medora.am",
    "metaghkaym.com",
    "mineconomy.am",
    "morevmankan.am",
    "mtech.am",
    "narim.am",
    "nla.am",
    "nortun.am",
    "office.am",
    "pba.am",
    "pik.am",
    "polytechnic.am",
    "prokat.am",
    "realwrp.org",
    "roadpolice.am",
    "shinshin.am",
    "steel.am",
    "take-away.am",
    "taniq.am",
    "telecomarmenia.am",
    "thecollector.am",
    "training-center.am",
    "utm.am",
    "vspc.am",
    "web.am",
    "yerevan.am",
    "zangakbookstore.am",
    "zero-lan.am",
    "zoreli.com"
  ],
  "examples": [
    "* Անուն, ազգանուն",
    "ԱՅԼ",
    "ԱՆՈՒՆ ԱԶԳԱՆՈՒՆ *",
    "ԱՆՈՒՆ*",
    "Ազգանուն*",
    "Անուն",
    "Անուն",
    "Անուն",
    "Անուն",
    "Անուն",
    "Անուն",
    "Անուն",
    "Անուն",
    "Անուն",
    "Անուն",
    "Անուն",
    "Անուն",
    "Անուն",
    "Անուն",
    "Անուն",
    "Անուն (ոչ պարտադիր)",
    "Անուն *",
    "Անուն *",
    "Անուն *",
    "Անուն *",
    "Անուն *",
    "Անուն *",
    "Անուն *",
    "Անուն *",
    "Անուն *",
    "Անուն *",
    "Անուն *",
    "Անուն *",
    "Անուն *",
    "Անուն *",
    "Անուն *",
    "Անուն *",
    "Անուն *",
    "Անուն *",
    "Անուն *",
    "Անուն *",
    "Անուն *",
    "Անուն Ազգանուն",
    "Անուն Ազգանուն",
    "Անուն Ազգանուն",
    "Անուն Ազգանուն",
    "Անուն Ազգանուն",
    "Անուն Ազգանուն",
    "Անուն Ազգանուն",
    "Անուն Ազգանուն",
    "Անուն Ազգանուն *",
    "Անուն Ազգանուն Հայրանուն *",
    "Անուն Ազգանուն Պարտադիր դաշտ",
    "Անուն Ազգանուն*",
    "Անուն Ազգանուն*",
    "Անուն Ազգանուն*",
    "Անուն Ազգանուն*",
    "Անուն Ազգանուն:",
    "Անուն ազգանուն պարտադիր դաշտ",
    "Անուն*",
    "Անուն*",
    "Անուն*",
    "Անուն*",
    "Անուն*",
    "Անուն*",
    "Անուն*",
    "Անուն*",
    "Անուն*",
    "Անուն, ազգանուն",
    "Անուն, ազգանուն",
    "Անուն, ազգանուն *",
    "Անուն, ազգանուն *",
    "Անուն, ազգանուն...",
    "Անուն/Ազգանուն*",
    "Անուն:",
    "Անուն:",
    "Անուն:*",
    "Անուն՝",
    "Գաղտնանուն *",
    "Էլ. հասցե կամ հեռախոսահամար",
    "Էլ. փոստ",
    "Էլ․ հասցե",
    "Էլ․հասցե*",
    "Ընկերության անվանում*",
    "Ընկերության անվանումը*",
    "Ընկերության կամ թիմի անվանում*",
    "Լրիվ անուն*․",
    "Կազմակերպության անվանում*",
    "Կոնտակտային անձի անուն, ազգանուն *",
    "ՀՎՀՀ*",
    "Հանրային Ծառայությունների Համարանիշ",
    "Ձեր անուն ազգանունը*",
    "Ձեր անունը",
    "Ձեր անունը",
    "Ձեր անունը",
    "Ձեր անունը*",
    "Ձեր էլ․ հասցեն",
    "Ճապոնական ստորև նշված միջոցառումներից ո՞րին կցանկանաք մասնակցել",
    "Պատվիրատուի Անուն Ազգանուն",
    "Վերնագիր"
  ],
  "exclusions": [],
  "id": "USAGE-UX-002",
  "layers": {
    "commercial": 52,
    "community": 4,
    "government": 22,
    "media": 2,
    "professional": 20
  },
  "query": "Armenian visible form-field label punctuation, segmented by colon use and stacked or inline layout",
  "total": 100,
  "variants": {
    "colon/inline": 3,
    "colon/stacked": 1,
    "no-colon/inline": 32,
    "no-colon/stacked": 62,
    "other-punctuation/stacked": 2
  }
}
