{
  "collected_at": "2026-08-14",
  "domains": [
    "a1plus.am",
    "aasw.org",
    "accountant.am",
    "advocates.am",
    "agat.am",
    "aist.global",
    "allrights.am",
    "appa.am",
    "apy.am",
    "arlis.am",
    "armla.am",
    "careercenter.am",
    "cba.am",
    "dasaran.am",
    "deedlex.com",
    "ecoinspect.am",
    "eftneu.am",
    "escs.am",
    "hcav.am",
    "hkdepo.am",
    "hmk.am",
    "iae.am",
    "idbank.am",
    "iravaban.net",
    "komo.am",
    "list.am",
    "luminex.am",
    "luys.am",
    "media.am",
    "mediapoint.am",
    "mepcad.am",
    "mfa.am",
    "nih.am",
    "nuaca.am",
    "onlyoffice.com",
    "peopleinneed.net",
    "shirakatsy.am",
    "sportedu.am",
    "thejobs.am",
    "uteach.io",
    "veolia.am",
    "yerevan.am",
    "ysmu.am",
    "ysu.am",
    "zangak.am"
  ],
  "examples": [
    "Subject line դաշտում՝ «ՏՏ պրոեկտ մենեջեր»։",
    "Subject line՝ «Տվյալների ինժեներ»։",
    "Subject դաշտը լրացվում է հայերեն, համառոտ և բովանդակալից։",
    "Subject դաշտում նշվում է աշխատատեղի անվանումը։",
    "Subject դաշտում նշվում է հաստիքի անվանումը։",
    "Subject դաշտում նշվում է պաշտոնի անվանումը։",
    "Subject դաշտում՝ «ՄՐՑՈՒՅԹ»։",
    "Subject դաշտում՝ «Մենեջեր»։",
    "Subject-ում նշվում է դասընթացի անվանումը։",
    "Subject՝ «IDBank-ի անվան կրթաթոշակ»։",
    "Subject՝ «ONLYOFFICE DocSpace անվճար լիցենզիա»։",
    "Subject՝ «Բիզնես Օգնական»։",
    "Subject՝ «Գրասենյակի Մենեջեր»։",
    "Subject՝ «Հաշվապահ/ հաշվետար»։",
    "Subject՝ «Մարտունի Ցերեկային Կենտրոն – Զարգացնող կրթական ծրագրերի մասնագետ»։",
    "Subject՝ «Վաճառքի Մենեջեր, Թբիլիսի»։",
    "Subject՝ «Վաճառքի Մենեջեր»։",
    "Subject՝ «Տրանսպորտային և երթևեկության ճարտարագետ / մոդելավորող»։",
    "Subject՝ «Փորձագետ – Ձեր Անուն Ազգանուն»։",
    "«Թեմա/Subject» դաշտում լրացնել նամակի էությանը վերաբերող վերնագիրը։",
    "«Թեմա» դաշտում բերվում է հաղորդագրության բովանդակության ամփոփ նկարագրությունը։",
    "Էլեկտրոնային նամակի թեմայում նշվում է ուսումնական հաստատության անվանումը և մասնախումբը։",
    "Թեմա դաշտում լրացրեք «Պատվեր» բառը։",
    "Թեմա դաշտում նշվում է հաստիքը, որի համար դիմում են։",
    "Թեմա դաշտում նշվում է հաստիքի անվանումը։",
    "Թեմա դաշտում նշվում է հաստիքի անվանումը։",
    "Թեմա դաշտում նշվում է պաշտոնի անվանումը։",
    "Թեմա դաշտում՝ «SMM Մասնագետ - TheJobs.am»։",
    "Թեմա դաշտում՝ «Ավագ հաշվապահ - TheJobs.am»։",
    "Թեմա դաշտում՝ «Ավագ հաշվապահ - TheJobs.am»։",
    "Թեմա դաշտում՝ «Բժշկական ներկայացուցիչ»։",
    "Թեմա դաշտում՝ «Գլխավոր հաշվապահ - TheJobs.am»։",
    "Թեմա դաշտում՝ «Գլխավոր հաշվապահ - TheJobs.am»։",
    "Թեմա դաշտում՝ «Գլխավոր հաշվապահ»։",
    "Թեմա դաշտում՝ «Երիտասարդական աշխատող | Երևան»։",
    "Թեմա դաշտում՝ «Իրավական ակտերի վերլուծության մասնագետ - TheJobs.am»։",
    "Թեմա դաշտում՝ «Լոգիստիկայի Բաժնի Մասնագետ»։",
    "Թեմա դաշտում՝ «Խոհարար - TheJobs.am»։",
    "Թեմա դաշտում՝ «Խոհարար - TheJobs.am»։",
    "Թեմա դաշտում՝ «Խոհարար - TheJobs.am»։",
    "Թեմա դաշտում՝ «ՀՔԱՎ կայքի ստեղծում»։",
    "Թեմա դաշտում՝ «Հաշվապահ - TheJobs.am»։",
    "Թեմա դաշտում՝ «Հաշվապահ - TheJobs.am»։",
    "Թեմա դաշտում՝ «Հաշվապահ - TheJobs.am»։",
    "Թեմա դաշտում՝ «Հաշվապահ - TheJobs.am»։",
    "Թեմա դաշտում՝ «Հաշվապահ - TheJobs.am»։",
    "Թեմա դաշտում՝ «Հաշվապահ-TheJobs.am»։",
    "Թեմա դաշտում՝ «Հաշվապահի օգնական - TheJobs.am»։",
    "Թեմա դաշտում՝ «Հաշվապահի օգնական - TheJobs.am»։",
    "Թեմա դաշտում՝ «Հաշվետար - TheJobs.am»։",
    "Թեմա դաշտում՝ «Հաշվետար - TheJobs.am»։",
    "Թեմա դաշտում՝ «Հումանիտար աջակցություն՝ հակամարտությունից տուժած խոցելի անձանց համար»։",
    "Թեմա դաշտում՝ «Հրուշակագործ - TheJobs.am»։",
    "Թեմա դաշտում՝ «Հրուշակագործ - TheJobs.am»։",
    "Թեմա դաշտում՝ «ՄՌԿ մասնագետ - TheJobs.am»։",
    "Թեմա դաշտում՝ «Մարքեթինգի և հասարակայնության հետ կապերի մասնագետ»։",
    "Թեմա դաշտում՝ «Ներմուծման մասնագետ - TheJobs.am»։",
    "Թեմա դաշտում՝ «Ներմուծման մենեջեր - TheJobs.am»։",
    "Թեմա դաշտում՝ «Ներմուծման մենեջեր - TheJobs.am»։",
    "Թեմա դաշտում՝ «Ներմուծման մենեջեր - TheJobs.am»։",
    "Թեմա դաշտում՝ «Ներմուծման մենեջեր - TheJobs.am»։",
    "Թեմա դաշտում՝ «Ներմուծման մենեջեր - TheJobs.am»։",
    "Թեմա դաշտում՝ «Ներմուծման մենեջեր - TheJobs.am»։",
    "Թեմա դաշտում՝ «Շուկայի զարգացման պատասխանատու - TheJobs.am»։",
    "Թեմա դաշտում՝ «Որակի ապահովման բաժնի ղեկավար»։",
    "Թեմա դաշտում՝ «Որակի ապահովման բաժնի մասնագետ»։",
    "Թեմա դաշտում՝ «Ուսումնական ծրագրերի թիմի անդամ»։",
    "Թեմա դաշտում՝ «Ջնջել անձնական տվյալները»։",
    "Թեմա դաշտում՝ «Սննդի տեխնոլոգ - TheJobs.am»։",
    "Թեմա դաշտում՝ «Վաճառող - TheJobs.am»։",
    "Թեմա դաշտում՝ «Վաճառքի մենեջեր - TheJobs.am»։",
    "Թեմա դաշտում՝ «Վարորդ առաքիչ - TheJobs.am»։",
    "Թեմա դաշտում՝ «մասնագետ-տեսուչ»։",
    "Թեմա/Subject դաշտում նշվում է աշխատանքի անվանումը։",
    "Թեմա/Subject՝ «Ֆոնդհայթայթման մասնագետ»։",
    "Թեմա՝ «Հաշվետվություններ ֆինանսական դիտարկումների կենտրոնին»։",
    "Թեմա՝ Ձեր անունով վարկ ստանալու հնարավորությունը X կազմակերպությունում ապաարգելափակված է",
    "Թեմայում նշվում է աշխատատեղի անվանումը՝ «Ավագ հաշվապահ»։",
    "Թեմայում նշվում է աշխատատեղի անվանումը՝ «Ավագ հաշվապահ»։",
    "Թեմայում նշվում է աշխատատեղի անվանումը՝ «Հաշվապահ»։",
    "Թեմայում՝ «Հաշվետար-օպերատոր»։",
    "Թեմայում՝ «Հետազոտող-իրավաբան»։",
    "Թեմայում՝ «Վաճառող-խորհրդատու»։",
    "Թեմայում՝ «Փաստաբան»։",
    "Թեմայում՝ Դուբայում կայանալիք առաջնությանը գրանցվելը։",
    "Նամակի թեմա դաշտում տեղադրվում է հայտարարության վերնագիրը։",
    "Նամակի թեմա դաշտում՝ «Տվյալների ջնջման հարցում»։",
    "Նամակի թեմայում նշեք ձեր նպատակային պաշտոնը։",
    "Նամակի թեմայում նշվում է Emoticon բառը։",
    "Նամակի թեմայում՝ «Գծագրող»։",
    "Նամակի թեմայում՝ «Խորհրդակցական աշխատանքային խումբ»։",
    "Որպես թեմա նշվում է ընտրական հանձնաժողովը և համայնքը։",
    "Վերնագիր դաշտում՝ CBA-2024-032։",
    "Վերնագիր դաշտում՝ Գևորգ Արշակյանի անվան կրթաթոշակ։",
    "Վերնագրում նշվում է ընդերքօգտագործման իրավունքի համարը և հաշվետվության ձևը։",
    "Վերնագրում նշվում է թափուր հաստիքի անվանումը։",
    "Վերնագրում նշվում է հիմնական հայտատուի անձնագրի համարը։",
    "Վերնագրում՝ «ՀԱՄԱՀԱՅԿԱԿԱՆ ԴՊՐՈՑԱԿԱՆ ՄՐՑՈՒՅԹ»։",
    "Վերնագրում՝ «Հարությունյան-90»։",
    "Վերնագրում՝ դիմողի անուն ազգանունը և անձնագրի համարը։"
  ],
  "exclusions": [],
  "id": "USAGE-BIZ-003",
  "layers": {
    "commercial": 60,
    "government": 13,
    "media": 5,
    "professional": 22
  },
  "query": "Armenian business-email subject-line punctuation, segmented by phrase, statement, and question",
  "total": 100,
  "variants": {
    "none/phrase": 99,
    "none/statement": 1
  }
}
