{
  "collected_at": "2026-08-14",
  "domains": [
    "acba.am",
    "armbusinessbank.am",
    "automarket.am",
    "byblosbankarmenia.am",
    "e-administrativecourt.am",
    "eset.com",
    "github.com",
    "glovoapp.com",
    "google.com",
    "hartak.am",
    "hoory.com",
    "mozilla.org",
    "src.am",
    "telecomarmenia.am",
    "telegram.org",
    "tickets.am",
    "translatewiki.net",
    "vega.am",
    "viva.am",
    "yandex.com"
  ],
  "examples": [
    "Delete 1 slide: Ջնջել 1 սահիկ։",
    "Delete Account: Ջնջել Հաշիվը",
    "Delete Account: Ջնջել հաշիվը",
    "Delete Account: Ջնջել հաշիվը",
    "Delete account: Ջնջել հաշիվը",
    "Delete account: Ջնջել հաշիվը",
    "Delete and Leave: Ջնջել և լքել",
    "Delete: Ջնջել",
    "Delete: Ջնջել",
    "Delete: Ջնջել",
    "Delete: Ջնջել",
    "Delete: Ջնջել",
    "Delete: Ջնջել",
    "Delete: Ջնջել",
    "Delete: Ջնջել",
    "Delete: Ջնջել",
    "RESET MY ACCOUNT: ՎԵՐԱԿԱՅԵԼ ԻՄ ՀԱՇԻՎԸ",
    "[Button: Ջնջել]",
    "[Ջնջել] կոճակը ջնջում է տվյալների դաշտերում նոր կատարած մուտքագրումները կամ խմբագրումները։",
    "account_delete: Ջնջել հաշիվը",
    "delete-account: Ջնջել հաշիվը",
    "delete_account: Ջնջել հաշիվը",
    "delete_account: Ջնջել հաշիվը",
    "settings.common.deleteAccountButton: Ջնջել հաշիվը",
    "«Խմբագրել» և «ջնջել» կոճակներով հնարավոր է խմբագրել և ջնջել սևագիր բողոքը։",
    "Անհրաժեշտ է սեղմել «Ապաակտիվացնել» կոճակը։",
    "Գրանցումների պատմության բաժնում սեղմել «Չեղարկել» կոճակը։",
    "Էջի ներքևում սեղմեք «Ջնջել հաշիվը» կոճակը։",
    "Կամայական նամակ հեռացնելու համար ընտրեք այն և սեղմեք Հեռացնել։",
    "Համապատասխան երեխայի պրոֆիլի կողքին հպեք ՉԵՂԱՐԿԵԼ ՀԱՍԱՆԵԼԻՈՒԹՅՈՒՆԸ կոճակին։",
    "Հաշիվը ջնջելու համար սեղմեք «Ջնջել հաշիվը» կոճակը։",
    "Մուտք գործեք պլանավորած պատվեր և սեղմեք «Չեղարկել պատվերը» կոճակը։",
    "Ջնջել",
    "Ջնջել",
    "Ջնջել",
    "Ջնջել",
    "Ջնջել",
    "Ջնջել",
    "Ջնջել",
    "Ջնջել",
    "Ջնջել",
    "Ջնջել",
    "Ջնջել",
    "Ջնջել",
    "Ջնջել",
    "Ջնջել",
    "Ջնջել",
    "Ջնջել",
    "Ջնջել",
    "Ջնջել",
    "Ջնջել",
    "Ջնջել",
    "Ջնջել",
    "Ջնջել",
    "Ջնջել",
    "Ջնջել",
    "Ջնջել",
    "Ջնջել",
    "Ջնջել",
    "Ջնջել",
    "Ջնջել",
    "Ջնջել",
    "Ջնջել",
    "Ջնջել",
    "Ջնջել",
    "Ջնջել",
    "Ջնջել",
    "Ջնջել $1",
    "Ջնջել {{PLURAL:$1|դասընթացը|դասընթացները}}",
    "Ջնջել {{PLURAL:$1|սյունակ|սյունակները}}",
    "Ջնջել {{PLURAL:$1|տող|տողերը}}",
    "Ջնջել աղյուսակը",
    "Ջնջել այս դաշտը",
    "Ջնջել այս էլփոստի հասցեն",
    "Ջնջել այս էջը",
    "Ջնջել այս էջը",
    "Ջնջել այս էջը",
    "Ջնջել բոլոր փոփոխությունները",
    "Ջնջել գիրքը",
    "Ջնջել էջը",
    "Ջնջել էջը",
    "Ջնջել թարգմանությունը",
    "Ջնջել թեման",
    "Ջնջել հաշիվը։ Դուք իսկապե՞ս ցանկանում եք ջնջել Ձեր հաշիվը։ Այո Ոչ։",
    "Ջնջել շերտեր",
    "Ջնջել պրոֆիլը",
    "Սեղմել «Տեղում եմ», «Չեղարկել» և «Ավարտել» կոճակները։",
    "Սեղմել Չեղարկել վճարումը կոճակը, եթե ցանկանում եք չեղարկել ապրանքի վճարումը։",
    "Սեղմել Ջնջել հաշիվը կոճակը, ապա՝ Այո, ջնջել։",
    "Սեղմեք «Չեղարկել պատվերը» կոճակը հավելվածում պատվերի էկրանին։",
    "Սեղմեք Ապաակտիվացնել ինքնության պաշտպանությունը։",
    "Փաստաթղթերի ցուցակում նշել փաստաթուղթը և սեղմել Հեռացնել։",
    "ջնջել",
    "ջնջել",
    "ջնջել",
    "ջնջել",
    "ջնջել",
    "ջնջել",
    "ջնջել բոլորը",
    "ջնջել հոդվածը"
  ],
  "exclusions": [],
  "id": "USAGE-UX-001",
  "layers": {
    "commercial": 15,
    "community": 81,
    "government": 3,
    "professional": 1
  },
  "query": "Armenian destructive-action control labels, segmented by wording form and action type",
  "total": 100,
  "variants": {
    "infinitive/access": 3,
    "infinitive/account": 15,
    "infinitive/content": 79,
    "infinitive/reset": 2,
    "other/account": 1
  }
}
