{
  "collected_at": "2026-08-14",
  "domains": [
    "arlis.am",
    "armbiotech.am",
    "armtimes.com",
    "cba.am",
    "e-draft.am",
    "futures-studio.org",
    "github.com",
    "google.com",
    "hetq.am",
    "idcarmenia.am",
    "job.am",
    "karingomcyan.wordpress.com",
    "medialab.am",
    "openai.com",
    "rebelleon.me",
    "sfu.ca",
    "shsu.am",
    "tcdsb.org",
    "times.am",
    "vemjournal.org"
  ],
  "examples": [
    "Ամենայն հարգանքով՝ [ուղարկողի ստորագրություն]",
    "Լավագույն մաղթանքներով [ուղարկողի ստորագրություն]",
    "Լավագույն մաղթանքներով [ուղարկողի ստորագրություն]",
    "Լավագույն մաղթանքներով [ուղարկողի ստորագրություն]",
    "Լավագույն մաղթանքներով [ուղարկողի ստորագրություն]",
    "Լավագույն մաղթանքներով [ուղարկողի ստորագրություն]",
    "Լավագույն մաղթանքներով [ուղարկողի ստորագրություն]",
    "Լավագույն մաղթանքներով [ուղարկողի ստորագրություն]",
    "Լավագույն մաղթանքներով, [ուղարկողի ստորագրություն]",
    "Լավագույն մաղթանքներով, [ուղարկողի ստորագրություն]",
    "Լավագույն մաղթանքներով, [ուղարկողի ստորագրություն]",
    "Խորին հարգանքով և հավատով՝ [ստորագրություն]",
    "Հարգանքներով [ուղարկողի ստորագրություն]",
    "Հարգանքներով [ուղարկողի ստորագրություն]",
    "Հարգանքներով [ուղարկողի ստորագրություն]",
    "Հարգանքներով [ուղարկողի ստորագրություն]",
    "Հարգանքներով [ուղարկողի ստորագրություն]",
    "Հարգանքներով [ուղարկողի ստորագրություն]",
    "Հարգանքներով [ուղարկողի ստորագրություն]",
    "Հարգանքներով [ուղարկողի ստորագրություն]",
    "Հարգանքներով [ուղարկողի ստորագրություն]",
    "Հարգանքներով [ուղարկողի ստորագրություն]",
    "Հարգանքներով [ուղարկողի ստորագրություն]",
    "Հարգանքներով [ուղարկողի ստորագրություն]",
    "Հարգանքներով [ուղարկողի ստորագրություն]",
    "Հարգանքներով [ուղարկողի ստորագրություն]",
    "Հարգանքներով [ուղարկողի ստորագրություն]",
    "Հարգանքներով [ուղարկողի ստորագրություն]",
    "Հարգանքներով [ուղարկողի ստորագրություն]",
    "Հարգանքներով [ուղարկողի ստորագրություն]",
    "Հարգանքներով [ուղարկողի ստորագրություն]",
    "Հարգանքներով [ուղարկողի ստորագրություն]",
    "Հարգանքներով [ուղարկողի ստորագրություն]",
    "Հարգանքներով [ուղարկողի ստորագրություն]",
    "Հարգանքներով [ուղարկողի ստորագրություն]",
    "Հարգանքներով [ուղարկողի ստորագրություն]",
    "Հարգանքներով [ուղարկողի ստորագրություն]",
    "Հարգանքներով [ուղարկողի ստորագրություն]",
    "Հարգանքներով [ուղարկողի ստորագրություն]",
    "Հարգանքներով [ուղարկողի ստորագրություն]",
    "Հարգանքներով [ուղարկողի ստորագրություն]",
    "Հարգանքներով [ուղարկողի ստորագրություն]",
    "Հարգանքներով, [ուղարկողի ստորագրություն]",
    "Հարգանքով [համակարգային ստորագրություն]",
    "Հարգանքով, HealthNet",
    "Հարգանքով, [X կազմակերպության անվանումը]",
    "Հարգանքով, [ապրանքային նամակի ստորագրություն]",
    "Հարգանքով, [աջակցման թիմ]",
    "Հարգանքով, [ուղարկողի ստորագրություն]",
    "Հարգանքով, uSupport թիմը",
    "Հարգանքով, {$contextName}",
    "Հարգանքով, {$contextSignature}",
    "Հարգանքով, Հարսանեկան թիմ",
    "Հարգանքով՝ AyGood River Lake",
    "Հարգանքով՝ Hayeli.am լրատվական ակումբ",
    "Հարգանքով՝ Patienthub.am թիմ",
    "Հարգանքով՝ [X կազմակերպության անվանումը]",
    "Հարգանքով՝ [Ձեր անունը և ազգանունը]",
    "Հարգանքով՝ [Ձեր անունը]",
    "Հարգանքով՝ [ապրանքային նամակի ստորագրություն]",
    "Հարգանքով՝ [գիտական նամակի ստորագրություն]",
    "Հարգանքով՝ [ծառայության ստորագրություն]",
    "Հարգանքով՝ [կազմակերպության ստորագրություն]",
    "Հարգանքով՝ [կազմակերպության ստորագրություն]",
    "Հարգանքով՝ [կազմակերպության ստորագրություն]",
    "Հարգանքով՝ [կազմակերպության ստորագրություն]",
    "Հարգանքով՝ [կազմակերպության ստորագրություն]",
    "Հարգանքով՝ [կազմակերպության ստորագրություն]",
    "Հարգանքով՝ [կազմակերպության ստորագրություն]",
    "Հարգանքով՝ [կազմակերպության ստորագրություն]",
    "Հարգանքով՝ [կազմակերպության ստորագրություն]",
    "Հարգանքով՝ [կազմակերպության ստորագրություն]",
    "Հարգանքով՝ [կազմակերպության ստորագրություն]",
    "Հարգանքով՝ [կազմակերպության ստորագրություն]",
    "Հարգանքով՝ [կազմակերպության ստորագրություն]",
    "Հարգանքով՝ [կազմակերպության ստորագրություն]",
    "Հարգանքով՝ [կազմակերպության ստորագրություն]",
    "Հարգանքով՝ [կազմակերպության ստորագրություն]",
    "Հարգանքով՝ [կազմակերպության ստորագրություն]",
    "Հարգանքով՝ [կազմակերպության ստորագրություն]",
    "Հարգանքով՝ [կազմակերպության ստորագրություն]",
    "Հարգանքով՝ [կազմակերպության ստորագրություն]",
    "Հարգանքով՝ [կազմակերպության ստորագրություն]",
    "Հարգանքով՝ [կազմակերպության ստորագրություն]",
    "Հարգանքով՝ [կազմակերպության ստորագրություն]",
    "Հարգանքով՝ [կազմակերպության ստորագրություն]",
    "Հարգանքով՝ [կազմակերպության ստորագրություն]",
    "Հարգանքով՝ [կազմակերպության ստորագրություն]",
    "Հարգանքով՝ [կազմակերպության ստորագրություն]",
    "Հարգանքով՝ [կազմակերպության ստորագրություն]",
    "Հարգանքով՝ [կազմակերպության ստորագրություն]",
    "Հարգանքով՝ [կազմակերպության ստորագրություն]",
    "Հարգանքով՝ [կազմակերպության ստորագրություն]",
    "Հարգանքով՝ [հետազոտական ստորագրություն]",
    "Հարգանքով՝ [ուղարկողի ստորագրություն]",
    "Հարգանքով՝ [ուղարկողի ստորագրություն]",
    "Հարգանքով՝ [տեղեկագրի ստորագրություն]",
    "Հարգանքով՝ ամառային դպրոցի կազմկոմիտե",
    "Շնորհակալություն ուշադրության համար: [ուղարկողի ստորագրություն]",
    "Շնորհակալություն, ՀՀ ԳԱԱ վարչություն"
  ],
  "exclusions": [],
  "id": "USAGE-BIZ-006",
  "layers": {
    "commercial": 1,
    "community": 80,
    "government": 5,
    "media": 5,
    "professional": 9
  },
  "query": "Armenian business-email closing formulas, segmented by relationship context",
  "total": 100,
  "variants": {
    "best-wishes/established-colleague": 7,
    "best-wishes/formal": 1,
    "best-wishes/neutral": 2,
    "respectfully/formal": 13,
    "respectfully/neutral": 75,
    "thanks/established-colleague": 1,
    "thanks/neutral": 1
  }
}
