{
  "collected_at": "2026-08-14",
  "domains": [
    "100bytelcell.am",
    "amara.am",
    "armbusinessbank.am",
    "armleasing.am",
    "automarket.am",
    "ayb.am",
    "e-administrativecourt.am",
    "easypay.am",
    "emall.am",
    "eset.com",
    "evoca.am",
    "github.com",
    "google.am",
    "inone.am",
    "ircenter.am",
    "khostum.am",
    "mediamonitoring.am",
    "mediawiki.org",
    "mozilla-l10n.github.io",
    "proz.com",
    "roadpolice.am",
    "shantdigitaltv.com",
    "soundscript.ai",
    "src.am",
    "tatever.am",
    "telecomarmenia.am",
    "telegram.org",
    "tickets.am",
    "translatewiki.net",
    "utm.am",
    "viva.am",
    "yerevan.am"
  ],
  "examples": [
    "$1 մասնակիցը ծանուցում է ստացել, որ դուք հավանել եք {{GENDER:$2|իր}} խմբագրումը։",
    "'''Զգուշացում. Դուք փորձում եք բեռնել նախկինում ջնջված նիշք։''' Խնդրում ենք վերանայել նիշքի բեռնման նպատակահարմարությունը։ Այս նիշքի ջնջման տեղեկամատյանը բերված է ստորև.",
    "<strong>Նկատի ունեցեք, որ դուք միայն նախադիտում եք ձեր մասնակցի CSS-նիշքը. այն դեռ հիշված չէ՛։</strong>",
    "<strong>Ուշադրությո՜ւն</strong>, Դուք ցանկանում եք տեղափոխել մասնակցային էջ: Խնդրում ենք ուշադրություն դարձնել, որ կանվանափոխվի միայն էջը. մասնակցային անունը <strong>չի</strong> վերանվանվի:",
    "URL-ում նշված գործողությունը սխալ է։ Հնարավոր է դուք վրիպակ եք թույլ տվել URL-ի մուտքագրման ժամանակ կամ հետևել եք սխալ հղմամբ։ Սա կարող է նաև լինել {{SITENAME}} նախագծում օգտագործվող ծրագրի սխալ։",
    "[[User:$1|$1]] ([[User talk:$1|քննարկում]]) մասնակիցը ջնջել է այս էջը ձեր խմաբգրումը սկսելուց հետո՝ հետևյալ պատճառով. : ''$2'' Խնդրում ենք հաստատել, որ դուք իսկապես ուզում եք վերստեղծել այս էջը։",
    "[Մուտք] կոճակը կիրառվում է, եթե ցանկանում եք հաստատել առաջարկվող գործողության կատարումը։",
    "{{GENDER:$1|Դուք}} միշտ կարող եք բացել կողամենյուն և սեղմել՝ $2 այստեղ վերադառնալու համար:",
    "{{GENDER:$3|Դուք}} կրկին կարող եք հսկել [$2 այս էջը], երբ ցանկանաք։",
    "{{PLURAL:$3|1=Դուք {{GENDER:$1|միակն եք}}<br />$4 իմացողներից|{{GENDER:$1|Դուք}} $4 թարգմանողների<br />միջև $2 տեղումն եք $3-ից<br />}}",
    "{{PLURAL:$3|1=Դուք միակն եք|{{GENDER:$1|Դուք}} $2 տեղումն եք $3-ից}}",
    "Այս էջը պաշտպանված է։ Դուք կարող եք դիտել նրա ելատեքստը։",
    "Այս կարգավորումը փոխելուց առաջ խնդրում ենք փակել TagSpaces-ի մյուս բոլոր պատուհանները։",
    "Այստեղ դուք կարող եք դիտել և փոխել '''<nowiki>$1</nowiki>''' էջի պաշտպանման մակարդակը։",
    "Անձնական տվյալներ բաժնում Դուք կարող եք խմբագրել անձնական տվյալները։",
    "Ավելի մեծ ճկունության համար խնդրում ենք փոխարենն օգտագործել ենթակոճակների խմբերի և դասավորության նոր ընտրանքները։",
    "Բաժանորդագրվելով ծառայությանը՝ Դուք ստանում եք բաղադրատոմսերի հասանելիություն։",
    "Դատարան ներկայացված բողոքները տեսնելու համար անհրաժեշտ է սեղմել «դիտել բողոքները» կոճակը։",
    "Դուք $1 կստանաք, երբ պատասխանը հրապարակվի մի քանի օրվա ընթացքում։",
    "Դուք այլևս մուտք գործած չեք։ Խնդրում եք մուտք գործեք այլ ներդիրից և կրկին փորձեք հիշել։",
    "Դուք անցել եք կոդի խմբագրմանը",
    "Դուք իսկապես ցանկանում եք ամբողջությամբ ջնջե՞լ ձեր գիրքը։",
    "Դուք խմբագրում եք թարգմանվող էջ: Նմանատիպ էջերում խմբագրումներ կատարելն այս գործիքով դեռևս չի աջակցվում:",
    "Դուք կատարել եք չափից շատ մուտքի փորձ։ Խնդրում ենք սպասել որոշ ժամանակ կրկին փորձելուց առաջ։",
    "Դուք կարող եք անել այնպես, որ այս նիշքը տեքստի հետ գտնվի մի տողի վրա:",
    "Դուք կարող եք ընտրել միայն $1 կետ։",
    "Դուք կարող եք նաև բացել տեսողական խմբագիրն յուրաքանչյուր բաժնում։",
    "Դուք կարող էք խմբագրել այս էջը։ Խնդրում ենք օգտագործել նախադիտման կոճակը հիշելուց առաջ։",
    "Դուք կստանաք էլ փոստի հաստատման հղում, որպեսզի կարողանաք տեղեկանալ պատասխաններից: Ձեր էլ փոստի հասցեն <strong>հասանելի չէ</strong> ուրիշների համար։",
    "Դուք հղվելու որևէ բան չեք նշել։",
    "Դուք հղվելու որևէ բան չեք նշել։",
    "Դուք հրապարակել եք Ձեր խմբագրումը։ Շնորհակալություն և շարունակե՜ք։",
    "Դուք միացրել էիք երկքայլ ստուգումը, ուստի Ձեր հաշիվը պաշտպանված է լրացուցիչ գաղտնաբառով։",
    "Դուք չեք կարող խմբագրել այս CSS էջը, քանի որ այն պարունակում է այլ մասնակցի անձնական նախընտրանքներ։",
    "Դուք չեք կարող խմբագրել այս ՋավաՍկրիպտ էջը, քանի որ այն պարունակում է այլ մասնակցի անձնական նախընտրանքներ։",
    "Դուք չեք կարող պատասխանել, քանի որ այս թեման թաքցվել է",
    "Դուք չեք կարող փոխել այս էջի սրբագրման կարգավիճակը։",
    "Դուք չեք կարող փոխել էջի պաշտպանման մակարդակը քանի դեռ արգելափակված եք։ Էջի ընթացիկ կարգավորումն է՝ '''$1'''.",
    "Դուք չեք կարող փոփոխել խմբի անդամակցությունը։",
    "Դուք չեք մտել համակարգ",
    "Դուք չեք նշել հաստատման արկղը։",
    "Դուք պահպանել եք Ձեր խմբագրումը։ Շնորհակալություն և շարունակե՜ք։",
    "Դուք պատրաստվում եք անցնել վիզուալ խմբագրմանը։ Ցանկանո՞ւմ եք շարունակել։",
    "Դուք պատրաստվում եք հեռացնել $1 ուսումնական հաստատությունները",
    "Դուք պատրաստվում եք ջնջել $1 ուսումնական հաստատությունները",
    "Դուք պետք է մուտք գործեք համակարգ",
    "Դուք ցանկացած պահին կարող եք միացնել ներածման գործիքները լեզվական կարգավորումներում, լեզուների ցանկի կողքը։",
    "Դուք ցանկացած պահին կարող եք միացնել ներածման գործիքները, լեզվական կարգավորումներից։",
    "Եթե Դուք որևէ սխալ գտնեք կայքի արդեն թարգմանված հատվածում, խնդրում ենք հայտնել համակարգողին։",
    "Եթե Ձեր տվյալները «Google Authenticator»-ից եք ներմուծում, խնդրում ենք վերագեներացնել տվյալների արխիվը և կրկին փորձել։",
    "Ես չգիտեմ թե դուք ինչպես եք այստեղ հայտնվել, բայց սա վտանգավոր տեղ է",
    "Երբ {{GENDER:$1|դուք}} արդեն արել եք որոշ խմբագրումներ:",
    "Երբ Դուք հարց եք տալիս, այն <strong>հրապարակվում է</strong> {{GENDER:$2|Ձեր}} մասնակցային անվան հետ միասին, $2, $3-ում, որտեղ էլ {{GENDER:$1|նրանք}} կարող են գտնել և պատասխանել Ձեր հարցին։",
    "Ընտրեք թեմաներ, որոնցով {{GENDER:$1|դուք}} հետաքրքրված եք",
    "Ընտրի՛ր ամենամսյա նվիրատվություն կատարելու տարբերակը և մուտքագրիր քո տվյալները։",
    "Ընտրիր քեզ համար հարմար բաժանորդագրության փաթեթը, որից հետո վճարիր քեզ հարմար տարբերակով։",
    "Ժամանակավոր գաղտնաբառը սխալ է։ Հնարավոր է դուք արդեն փոխել եք գաղտնաբառը կամ նորն եք հայցել։",
    "Լրացուցիչ տեղեկության համար խնդրում ենք կապվել հղումը ուղարկողի հետ։",
    "Լրացրե՛ք Ձեր կոնտակտային տվյալները։",
    "Լրացրեք հայտը, և մենք կպատասխանենք ձեզ հնարավորինս շուտ։",
    "Լրացրեք ֆորման և մեր աշխատակիցները կապ կհաստատեն Ձեզ հետ։",
    "Խմբեր, որոնք դուք կարող եք ձևափոխել",
    "Խնդրում ենք դիմել ձեր ադմինիստրատորին։",
    "Խնդրում ենք ընտրել այլ դաշտ։",
    "Խնդրում ենք ընտրել վավեր գրադարան։",
    "Խնդրում ենք ընտրել տեսացանկ։",
    "Խնդրում ենք կրկին փորձել կամ դիմել support@getmailspring.com։",
    "Խնդրում ենք մանրամասն ստուգել Ձեր կողմից մուտքագրված տվյալները։",
    "Խնդրում ենք ստուգել, որ խնդիրն արդեն հաղորդված չէ։",
    "Խնդրում ենք վճարել։",
    "Խորհուրդ է տրվում, երբ {{GENDER:$1|Դուք}} սկսում եք սովորել:",
    "Ծանոթագրությունը միայն արտաքին հղում է։ Դուք կարող եք օգտագործել {{int:citoid-referencecontextitem-convert-button}} կոճակը՝ ճիշտ ձևավորված ծանոթագրություն ստանալու համար։",
    "Կենտրոնը հնարավորինս սեղմ ժամկետներում կարձագանքի Ձեր նամակին։",
    "Համոզվեք, որ բավականաչափ ազատ տեղ ունեք Ձեր սարքում։",
    "Հաստատման համար մուտքագրեք ձեր գաղտնաբառը։",
    "Հարգելի՛ օգտատեր, նամակում հարկավոր է նշել Ձեր անունը և ազգանունը։",
    "Հարցերի և առաջարկների դեպքում կարող ես մեզ հետ կապ հաստատել այստեղ։",
    "Ձեր Instagram պրոֆիլը որպես ալիք ավելացնելու համար անհրաժեշտ է հաստատել ձեր Instagram պրոֆիլը՝ սեղմելով «Շարունակել Instagram-ով» կոճակը։",
    "Ձեր արժույթը չի սպասարկվում: Եթե Դուք որոշել եք շարունակել, ապա մշակումը կկատարվի $1",
    "Ձեր նշած URL-ը նման է վիքիի այլ էջին հղմանը։ Դուք ուզո՞ւմ եք այս հղումը սարքել ներքին։",
    "Մենք նկատել ենք, որ մասնակցային հաշիվը ստեղծելիս Դուք չեք ավելացրել Ձեր էլ-փոստի հասցեն։ <strong>Խորհուրդ է տրվում</strong> ավելացնել էլ-փոստի հասցեն, քանի որ գաղտնաբառը մոռանալու դեպքում այն կարող է օգտագործվել հաշիվը վերականգնելու համար։",
    "Մենք սիրով կլսենք Ձեր կարծիքն ու հարցերը։",
    "Մեքենաներ ենթաբաժնում Դուք կարող եք տեսնել Ձեր կողմից ստեղծված մեքենաների ցուցակը։",
    "Միացրեք ձեր արվեստը գլոբալ լսարանին։",
    "Մուտք գործեք ձեր ESET HOME հաշիվ։",
    "Մուտքագրեք Ձեր գաղտնաբառը",
    "Ներբեռնի'ր հավելվածը և ստեղծի'ր քո թվային քարտը։",
    "Ներբեռնիր easywallet-ը և գրանցվիր՝ լրացնելով դաշտերը։",
    "Ներբեռնիր հավելվածը և ակտիվացրու ծառայությունը՝ մուտքագրելով քո բջջային հեռախոսահամարը։",
    "Ներդրում ունենալու համար Դուք պետք է անեք միայն մեկ կամ երկու փոքր ուղղում։ Դուք պարտավոր չեք ամբողջ հոդվածի վրա աշխատել։ Ձեզնից նաև չի պահանջվում թեմային մասին հատուկ գիտելիքներ ունենալ։",
    "Նշեք՝ ինչպես կարող ենք ձեզ օգնել։ Մանրամասն նկարագրեք ձեր խնդիրը։",
    "Նույնականացման քարտով մուտք գործելու դեպքում Ձեզ հասանելի կլինեն կայքի բոլոր ծառայությունները։",
    "Շարունակելուց առաջ խնդրում ենք ակտիվացնել երկու գործոնով նույնականացումը։",
    "Պատվիրիր Evoca Digital քարտը հիմա EvocaTOUCH հավելվածով։",
    "Սա մի ձեռնարկ է, որը կօգնի Ձեզ մասնակցելու Mozilla-ի նախագծերի հայերեն թարգմանությանը։",
    "Սեղմիր Գրանցվել, մուտքագրիր քո էլ. փոստն ու գաղտնաբառը, ապա ընտրիր պլան։",
    "Սույնով տեղեկացնում ենք Ձեզ My Team հավելվածից Ձեր հաշիվը ջնջելու գործընթացի մասին։",
    "Վերբեռնումը ձախողվեց: Լրացուցիչ տեղեկությունների համար խնդրում ենք ստուգել վահանակը։",
    "Տոմս գնելով՝ Դուք համաձայնվում եք պայմաններին։",
    "Քաշեք և թողեք։"
  ],
  "exclusions": [],
  "id": "USAGE-UX-003",
  "layers": {
    "commercial": 22,
    "community": 72,
    "government": 4,
    "professional": 2
  },
  "query": "Armenian interface register of direct address, segmented by register and audience",
  "total": 100,
  "variants": {
    "formal/customer": 16,
    "formal/general": 54,
    "formal/government-service": 3,
    "formal/professional": 6,
    "formal/student": 1,
    "impersonal/customer": 6,
    "impersonal/general": 1,
    "impersonal/government-service": 1,
    "impersonal/professional": 4,
    "informal/customer": 7,
    "informal/general": 1
  }
}
